{
  "network_name": "Testnet",
  "cosmos_chain_id": "mono_6940-1",
  "evm_chain_id": 6940,
  "evm_chain_id_hex": "0x1b1c",
  "genesis_url": "https://raw.githubusercontent.com/monolythium/networks/main/testnet/genesis.json",
  "genesis_sha256": "0000000000000000000000000000000000000000000000000000000000000000",
  "seeds": [],
  "bootstrap_peers": [],
  "snapshot_url": "https://snapshots.testnet.mononodes.xyz/latest.tar.lz4",
  "rpc_endpoints": {
    "cosmos_rpc": ["https://rpc.testnet.mononodes.xyz"],
    "cosmos_rest": ["https://api.testnet.mononodes.xyz"],
    "evm_rpc": ["https://evm.testnet.mononodes.xyz"],
    "evm_ws": ["wss://evm.testnet.mononodes.xyz"]
  },
  "port_scheme": {
    "rpc": 26657,
    "p2p": 26656,
    "rest": 1317,
    "grpc": 9090,
    "evm_rpc": 8545,
    "evm_ws": 8546
  },
  "network_status": "active",
  "config_version": "1.0.0",
  "updated_at": "2026-03-26T00:00:00Z"
}
