{
  "network_name": "Mainnet",
  "cosmos_chain_id": "mono_6941-1",
  "evm_chain_id": 6941,
  "evm_chain_id_hex": "0x1b1d",
  "genesis_url": "https://raw.githubusercontent.com/monolythium/networks/main/mainnet/genesis.json",
  "genesis_sha256": "0000000000000000000000000000000000000000000000000000000000000000",
  "seeds": [],
  "bootstrap_peers": [],
  "rpc_endpoints": {
    "cosmos_rpc": [],
    "cosmos_rest": [],
    "evm_rpc": [],
    "evm_ws": []
  },
  "port_scheme": {
    "rpc": 26657,
    "p2p": 26656,
    "rest": 1317,
    "grpc": 9090,
    "evm_rpc": 8545,
    "evm_ws": 8546
  },
  "network_status": "testing",
  "config_version": "1.0.0",
  "updated_at": "2026-01-06T00:00:00Z"
}
